{
    "total_weight_with_rider_kg": 75.0,
    "frontal_area_of_rider_m2": 2.9,
    "wheel_diameter_m": 0.09,
    "battery_max_capacity_Ah": 6.0,
    "battery_max_voltage": 42.0,
    "gear_ratio": 2.25,
    "motor_kv": 190,
    "motor_max_torque": 3.57,
    "motor_max_amps": 85.0,
    "motor_max_power_watts": 3500.0,
    "motor_pole_pairs": 7,
    "com_port": "/dev/ttyUSB0",
    "baud_rate": 230400,
    "fixed_time_step_ms": 10,
    "push_period_sec": 30.0,
    "theta_slope_period_sec": 5.0,
    "slope_range_bound_deg": 15.0,
    "mu_rolling": 0.03,
    "c_drag": 0.8,
    "control_time_step_sec": 0.01,
    "vesc_fw": "6.00",
    "heartbeat_timeout_sec": 1.5
  }